,file_path,sentence,section,entities,labels,position_start,position_end,abbreviations,abbreviations_longform,abbreviation_start,abbreviation_end
209,C:\Users\shiwa\pastoral_74\PMC9623530\sections\1_front\1_article-meta\8_aff.xml,    2     Department of Natural and Life Sciences   Faculty of Sciences   University of Msila   Msila   Algeria,AFF,"Department of Natural and Life Sciences, ""University of Msila""","ORG, ORG","10, 74","49, 94",,,,
211,C:\Users\shiwa\pastoral_74\PMC9791103\sections\1_front\1_article-meta\10_aff.xml,"  5   Deparment of Animal Genetics and Breeding ,  Veterinary College and Research Institute ,  Tamil Nadu Veterinary and Animal Sciences University ,  Chennai ,  India",AFF,"Breeding, Veterinary College, Research Institute, Tamil Nadu Veterinary, Animal Sciences University","ORG, ORG, ORG, ORG, ORG","39, 51, 74, 96, 122","47, 69, 92, 117, 148",,,,
212,C:\Users\shiwa\pastoral_74\PMC9791103\sections\1_front\1_article-meta\11_aff.xml,"  6   Départment of Agronomy ,  Faculty of Natural Science and Life ,  Abdelhamid Ibn Badis ,  University ,  Mostaganem ,  Algeria",AFF,"Faculty of Natural Science and Life, Mostaganem","ORG, ORG","32, 109","67, 119",,,,
213,C:\Users\shiwa\pastoral_74\PMC9791103\sections\1_front\1_article-meta\12_aff.xml,"  7   Department of Animal Science ,  Faculty of Agriculture ,  Bingöl University ,  Bingöl ,  Turkey",AFF,"Department of Animal Science, Bingöl University","ORG, ORG","6, 64","34, 81",,,,
214,C:\Users\shiwa\pastoral_74\PMC9791103\sections\1_front\1_article-meta\6_aff.xml,"  1   Department of Animal Science ,  Faculty of Agriculture ,  Centre for Sustainable Agriculture and Rural Development ,  Shabu-Lafia Campus ,  Nasarawa State University ,  Keffi ,  Nigeria",AFF,"Department of Animal Science, Centre for Sustainable Agriculture, Rural Development, Shabu-Lafia Campus, Nasarawa State University","ORG, ORG, ORG, ORG, ORG","6, 64, 103, 124, 146","34, 98, 120, 142, 171",,,,
215,C:\Users\shiwa\pastoral_74\PMC9791103\sections\1_front\1_article-meta\7_aff.xml,"  2   Discipline of Genetics ,  School of Life Sciences ,  University of Kwa-Zulu Natal ,  Durban ,  South Africa",AFF,"Discipline of Genetics, School of Life Sciences, University of Kwa-Zulu Natal","ORG, ORG, ORG","6, 32, 59","28, 55, 87",,,,
216,C:\Users\shiwa\pastoral_74\PMC9791103\sections\1_front\1_article-meta\8_aff.xml,"  3   Department of Animal Science ,  Landmark University ,  Omu-Aran ,  Nigeria",AFF,"Department of Animal Science, Landmark University","ORG, ORG","6, 38","34, 57",,,,
217,C:\Users\shiwa\pastoral_74\PMC9791103\sections\1_front\1_article-meta\9_aff.xml,"  4   Department of Animal Science ,  Federal University Dutse ,  Dutse ,  Nigeria",AFF,"Department of Animal Science, Federal University Dutse","ORG, ORG","6, 38","34, 62",,,,
